<?xml version="1.0" encoding="UTF-8"?>
<!-- The base directory is set to be the parent folder of the configuration
file. -->
<configuration baseDir="rsc"
	xmlns:xsi="http://www.w3.org/2001/XMLSchema-instance"
	xsi:noNamespaceSchemaLocation="configuration.xsd">
	
	<application>
		<document-schema>schema/CDA.xsd</document-schema>
		<!-- The PDF Level used for Validation:
		1a: PDF/A 1a, ISO 19005-1, Level A compliance
		1b: PDF/A 1b, ISO 19005-1, Level B compliance
		2a: PDF/A 2a, ISO 19005-2, Level A compliance
		2b: PDF/A 2b, ISO 19005-2, Level B compliance
		2u: PDF/A 2u, ISO 19005-2, Level U compliance
		3a: PDF/A 3a, ISO 19005-3, Level A compliance
		3b: PDF/A 3b, ISO 19005-3, Level B compliance
		3u: PDF/A 3u, ISO 19005-3, Level U compliance
		-->
		<pdf-level>1a</pdf-level>

		<!-- The level of validation result reporting:
		0: none Nothing is reported
		1: errors Errors are reported
		2: warnings Errors and warnings are reported
		3: information Error, warnings and information are reported
		-->
		<pdf-reporting-level>3</pdf-reporting-level>

		<!-- The license-key for the pdf-tools software -->
		<!-- Uncomment the license-key only if you pdf-tools installed -->

		<!-- <license-key>yourkey</license-key>  -->
	</application>


	<!-- The Schematrons are located at a path relative to the base directory. -->
	<schematron dir="schematron">

		<!-- Rule-Sets for Unit testing -->
		<rule-set file="miniCDA.sch">
			<description>Just for Unit tests</description>
			<display-name>miniCDA</display-name>
			<templateId>2.999</templateId>
		</rule-set>
	</schematron>

</configuration>
